id	Q_chn	Q	Time	Time_UTC	Interp_chn	A_chn	A	Interp	Primary_id	Alter_id	Day_Stem
12	一妇测其丈夫何日出狱？	A woman asks when her husband will be released from prison.	丁亥年丙子月丙申日	2008-01-08T00:00:00Z	丈夫克世，但丑土为狱之象，官鬼申支持世，卦中有卯未子午辰，必用寅救灾之兆。	此卦说明不急，等待六日，看丙午日有消息。丈夫大概率两日内出狱，或晚上也可能获释。	This hexagram indicates there is no rush. Wait six days; news may arrive on the day of Bingwu. The husband is highly likely to be released from prison within two days, possibly even at night.	A husband overcomes the world, yet the Chou Earth symbolizes imprisonment. The official spirits of Shen support the world. Within the hexagram, there are Mao, Wei, Zi, Wu, and Chen, indicating a sign that must use Yin to avert disaster.	12	23	bing
13	测求财何时得利？	When will I gain financial benefits?	甲戌年丁巳月甲子日	1994-06-07T00:00:00Z	求财以财爻为用，世爻临财卯，世爻合月用财；空文生克间，可得收益，但非丰厚。	主卦求财带辛苦，暗示需关注兄弟持世，避免分争之象。吉利之兆。	"The primary hexagram suggests financial gain will come with hardship. It implies the need to pay attention to the ""brother line"" (indicating potential competition) to avoid disputes. Overall, it is a favorable sign."	To seek wealth, use the wealth line as the function. The active line is associated with wealth and encounters the wealth line in the month; when considered between emptiness and generating-restricting cycles, gains can be obtained, but they will not be abundant.	22	53	jia
14	工程投标能否中标？	Will my project bid be successful?	癸未年乙卯月癸巳日	2003-03-21T16:17:52Z	风泽中孚卦，离火在下，艮山在上。分析以父母交为用神，父母爻主合同、标书，卦中父母休囚，故未中标。	卦象显示无明显财爻生扶，且用神被克冲，难成。	The hexagram shows no evident financial line providing support, and the useful spirit is being suppressed and clashed, making success unlikely.	The Wind and Lake Hexagram speaks of an inner sincerity, with Fire below and Mountain above. The analysis takes the parents as the useful spirit, where the parent line indicates contracts and documents. In the hexagram, the parent line is weak and inactive, hence the contract was not secured.	61	42	gui
15	典铺经营情况如何？	How is the pawnshop's business doing?	甲申年乙亥月丙午日	2004-11-23T01:22:32Z	世爻日辰被冲，财爻不稳，典铺经营需谨慎，短期内不可久。	世爻逢冲，财爻受克，整体呈现短期不利，宜调整策略。	The self-line encounters conflict, and the financial line is being suppressed. The overall situation appears unfavorable in the short term, and adjusting the strategy is recommended.	The line of the world and the day branch are in conflict, indicating that the wealth line is unstable. Management of the pawnshop must be cautious, and it should not operate for an extended period in the short term.	34	21	bing
16	文书是否能顺利办好？	Will the paperwork be successfully completed?	辛丑年丙申月壬寅日	2021-08-22T00:29:53Z	卦中父母交为用神，动临月建生扶世爻，显示文书能顺利完成。	父母爻旺相生世，主文书最终可成，宜早办。	"The ""parent line"" (representing authority or paperwork) is strong and supports the self-line, indicating that the paperwork will eventually succeed. It is advisable to handle it early."	In the hexagram, the parents intersect to serve as the significant spirit, moving to align with the monthly build to support the subject line, indicating that the documents can be completed smoothly.	59	60	ren
17	师生关系能否继续？	Can the teacher-student relationship continue?	丙申年甲午月庚辰日	2016-06-27T20:49:13Z	卦象不利，世爻被克，师生关系有变，最终恐难长久。	师爻生扶不足，世爻日辰受克，关系或将终结。	The teacher line shows insufficient support, and the self-line is suppressed by the current day's energies, suggesting the teacher-student relationship might come to an end.	The hexagram image is unfavorable, the main line is subdued, and the teacher-student relationship changes, ultimately fearing difficulty in lasting.	51	63	geng
