id,Q_chn,open,Q,Time,Interp_chn,A_chn,A,Interp,Primary_id,Alter_id,Day_Stem
128,是否能顺利完成近期重大交易？,0,Can you successfully complete recent major transactions?,丙辰年甲午月庚寅日,"
财爻旺动，显示交易的各项条件已成熟。
世爻化进，提示测者需注意流程细节，以确保交易顺利完成。",反馈交易如期完成，双方满意。?(六爻实战卦100例2),Feedback The transaction was completed as scheduled and both parties were satisfied. ?(Example 2 of 100 Six Yao Practical Battle Hexagrams),"The money line is prosperous, indicating that the conditions for the transaction have matured.
Shiyaohuajin reminds testers to pay attention to the details of the process to ensure that the transaction is completed smoothly.",22,9,geng
129,是否能与亲戚和解？,0,Is it possible to reconcile with relatives?,甲午年乙未月丁酉日,"
兄弟爻旺动，显示家庭关系中存在沟通障碍。
世爻静而化退，提示和解需从双方理解与耐心入手。",反馈矛盾逐步化解，家庭关系恢复和谐。?(六爻名家卦例大收集47),"Feedback conflicts are gradually resolved and family relationships are restored to harmony. ?(A large collection of six-line hexagrams from famous masters, 47)","The brothers' lines are vigorous and active, indicating that there are communication barriers in family relationships.
The world fades away quietly, reminding that reconciliation requires understanding and patience from both parties.",37,33,ding
130,是否适合近期推出新营销活动？,0,Is it suitable to launch a new marketing campaign in the near future?,癸巳年甲午月乙亥日,"
财爻旺动化吉，显示营销活动时机良好，预期效果较佳。
世爻旺相，提示测者需注重活动创意及推广力度。",反馈活动成功，客户转化率提升。?(六爻实战卦100例2),The feedback campaign was successful and the customer conversion rate increased. ?(Example 2 of 100 Six Yao Practical Battle Hexagrams),"A prosperous financial line turns into good luck, indicating that the timing of marketing activities is good and the expected results are better.
The prosperity of the world reminds testers to pay attention to the creativity and promotion of activities.",42,14,yi
131,是否能顺利协调与同事的分歧？,0,Can you successfully reconcile differences with colleagues?,乙未年丙午月庚辰日,"
用神兄弟爻旺动，显示同事间的分歧有望调和。
世爻静，提示测者需耐心倾听并找到共同利益点。",反馈矛盾化解，团队合作更加融洽。?(六爻实战卦100例2),Feedback conflicts are resolved and teamwork becomes more harmonious. ?(Example 2 of 100 Six Yao Practical Battle Hexagrams),"Use the word ""God Brothers"" to show that differences between colleagues are expected to be reconciled.
The quiet world reminds testers to listen patiently and find common interests.",25,20,geng
132,是否能顺利完成年度考核目标？,0,Can you successfully complete the annual assessment goals?,甲申年乙未月庚寅日,"
官鬼爻旺动，显示考核目标具备实现的可能。
世爻旺相，提示测者需注重时间管理和计划执行。",反馈目标如期完成，考核结果优秀。?(六爻实战卦100例2),The feedback objectives were completed on schedule and the assessment results were excellent. ?(Example 2 of 100 Six Yao Practical Battle Hexagrams),"The official and ghost lines are moving vigorously, indicating that the assessment goals are likely to be achieved.
The prosperous aspect of the world reminds testers to pay attention to time management and plan execution.",13,31,geng
133,孩子是否能进入理想学校？,0,Will my child get into the ideal school?,癸未年壬午月丁卯日,"
子孙爻旺动，显示孩子具备进入理想学校的能力和条件。
世爻静，提示测者需协助孩子完善申请材料。",反馈孩子成功入学，学习环境优越。?(六爻名家卦例大收集47),"Feedback: The child successfully entered school and the learning environment is excellent. ?(A large collection of six-line hexagrams from famous masters, 47)","The children and grandchildren are prosperous, indicating that the child has the ability and conditions to enter the ideal school.
Shi Yaojing reminds test takers to help their children complete the application materials.",31,42,ding
134,是否能妥善处理客户投诉？,0,Can customer complaints be properly handled?,丙辰年癸未月庚寅日,"
财爻旺动，显示客户的投诉具有较大影响力。
世爻化吉，提示测者需冷静应对，提出有效解决方案。",反馈投诉处理妥当，客户关系修复。?(六爻实战卦100例2),Feedback complaints are properly handled and customer relationships are repaired. ?(Example 2 of 100 Six Yao Practical Battle Hexagrams),"The money line is prosperous, indicating that customer complaints have greater influence.
Shiyao turns into good luck, reminding testers to deal with it calmly and come up with effective solutions.",40,41,geng
135,是否适合近期开展团队建设活动？,0,Is it suitable for a team building activity in the near future?,癸巳年甲午月丁酉日,"
财爻旺动，显示团队建设活动能够增强凝聚力。
世爻旺相，提示测者需设计有吸引力的活动形式。",反馈活动成功举办，团队氛围明显改善。?(六爻实战卦100例2),The feedback event was successfully held and the team atmosphere was significantly improved. ?(Example 2 of 100 Six Yao Practical Battle Hexagrams),"The money line is prosperous, indicating that team building activities can enhance cohesion.
The prosperous phase of the world reminds the test taker to design attractive activities.",14,25,ding
136,是否能顺利完成年度销售目标？,0,Can the annual sales target be successfully achieved?,癸未年甲午月乙亥日,"
财爻旺动化吉，显示销售目标具备实现的可能性。
世爻静，提示测者需优化销售策略，合理分配资源。",反馈销售目标提前完成，年度收益显著增长。?(六爻名家卦例大收集47),"Feedback showed that sales targets were achieved ahead of schedule and annual revenue increased significantly. ?(A large collection of six-line hexagrams from famous masters, 47)","A prosperous financial line turns into auspiciousness, indicating that the sales target is likely to be achieved.
Shi Yaojing reminds testers that they need to optimize their sales strategies and allocate resources reasonably.",22,37,yi
137,是否适合近期参与大型展会？,0,Is it suitable to participate in large-scale exhibitions in the near future?,丙辰年壬午月庚寅日,"
财爻旺动，显示展会活动能够带来可观收益。
世爻静而得日扶，提示测者需充分准备展会相关物料。",反馈展会表现良好，品牌知名度提升。?(六爻实战卦100例2),Feedback: The exhibition performed well and brand awareness increased. ?(Example 2 of 100 Six Yao Practical Battle Hexagrams),"The financial fortune is prosperous, indicating that exhibition activities can bring considerable profits.
The world is quiet and the day is supported, reminding testers to fully prepare exhibition-related materials.",40,50,geng
138,近期是否适合扩大公司规模？,0,Is it suitable to expand the company in the near future?,癸巳年乙未月庚辰日,"
财爻旺动，显示公司扩张具备资源基础。
世爻旺相，提示测者需注意新领域的风险管控。",反馈扩张顺利，业务范围拓展成功。?(六爻实战卦100例2),Feedback is that the expansion is smooth and the business scope has been successfully expanded. ?(Example 2 of 100 Six Yao Practical Battle Hexagrams),"The wealth is booming, indicating that the company has the resource base for expansion.
The prosperity of the world reminds testers to pay attention to risk management and control in new fields.",13,9,geng
139,是否能顺利完成孩子的入学手续？,0,Can the child's enrollment procedures be successfully completed?,甲申年乙未月庚寅日,"
父母爻旺动，显示入学手续办理较为顺利。
世爻静而化吉，提示测者需提前准备相关材料。",反馈手续顺利完成，入学时间如期安排。?(六爻实战卦100例2),The feedback procedures were successfully completed and the enrollment time was scheduled as scheduled. ?(Example 2 of 100 Six Yao Practical Battle Hexagrams),"The parents are very active, indicating that the admission procedures are relatively smooth.
The world is quiet and auspicious, suggesting that test takers need to prepare relevant materials in advance.",25,30,geng
140,是否能成功解决供应链问题？,0,Can supply chain issues be successfully addressed?,丙辰年甲午月乙亥日,"
财爻旺动化进，显示供应链问题具备解决可能。
世爻旺相，提示测者需主动协调各方资源。",反馈供应链逐步恢复正常，生产稳定进行。?(六爻名家卦例大收集47),"Feedback indicates that the supply chain is gradually returning to normal and production is proceeding stably. ?(A large collection of six-line hexagrams from famous masters, 47)","The financial situation is booming, indicating that supply chain problems may be solved.
The prosperous phase of the world reminds testers to take the initiative to coordinate resources from all parties.",42,45,yi
141,是否能顺利完成年度审计？,0,Can the annual audit be successfully completed?,癸巳年甲午月丁酉日,"
财爻旺动，显示审计材料准备充分。
世爻静，提示测者需重点关注数据细节。",反馈审计顺利通过，无重大问题。?(六爻实战卦100例2),The feedback audit passed successfully with no major issues. ?(Example 2 of 100 Six Yao Practical Battle Hexagrams),"The financial line is prosperous, indicating that the audit materials are well prepared.
Shi Yaojing reminds test takers to pay attention to the details of the data.",14,33,ding
142,是否能及时完成重要的维修项目？,0,Can important maintenance projects be completed in a timely manner?,甲午年乙未月庚辰日,"
父母爻旺动，显示维修过程进展顺利。
世爻静而化吉，提示测者需合理安排人力和预算。",反馈维修如期完成，后续运行稳定。?(六爻实战卦100例2),Feedback is that the maintenance was completed as scheduled and subsequent operations are stable. ?(Example 2 of 100 Six Yao Practical Battle Hexagrams),"The parents are moving vigorously, indicating that the repair process is progressing smoothly.
The world is quiet and auspicious, reminding testers that they need to reasonably arrange manpower and budget.",45,20,geng
143,是否能成功获取政府项目支持？,0,Can you successfully obtain government project support?,乙未年丙午月庚辰日,"
官鬼爻旺动，显示项目具备较高的政府支持可能性。
世爻旺相，提示测者需加强申请文件的完整性。",反馈项目获批，资金及时到位。?(六爻名家卦例大收集47),"The feedback project was approved and funds were received in a timely manner. ?(A large collection of six-line hexagrams from famous masters, 47)","The official and ghost lines are active, indicating that the project has a high possibility of government support.
The prosperity of the world reminds candidates to strengthen the integrity of application documents.",18,25,geng
144,是否适合近期与新客户合作？,0,Is it suitable to cooperate with new customers in the near future?,癸未年甲午月丁卯日,"
财爻旺动，显示新客户合作有较大潜力。
世爻静而化吉，提示测者需详细了解客户背景。",反馈合作进展顺利，带来可观收益。?(六爻名家卦例大收集47),"Feedback The cooperation is progressing smoothly and has brought considerable benefits. ?(A large collection of six-line hexagrams from famous masters, 47)","The money line is prosperous, indicating that there is great potential for cooperation with new customers.
The world is quiet and auspicious, suggesting that testers need to understand the customer's background in detail.",42,9,ding
145,是否能找到合适的新员工？,0,Can you find suitable new employees?,丙辰年壬午月庚寅日,"
官鬼爻旺动，显示招聘条件合理，有较大可能找到理想人选。
世爻静而得日扶，提示测者需明确职位需求。",反馈新员工表现优异，与团队配合融洽。?(六爻实战卦100例2),Feedback that new employees perform well and work well with the team. ?(Example 2 of 100 Six Yao Practical Battle Hexagrams),"The official and ghost lines are active, indicating that the recruitment conditions are reasonable and it is more likely to find the ideal candidate.
The world is quiet and the day is supported, which reminds the test taker to clarify the job requirements.",31,50,geng
146,是否适合近期启动新技术项目？,0,Is it suitable for launching new technology projects in the near future?,甲午年乙未月庚辰日,"
财爻旺动化吉，显示项目启动条件良好。
世爻静而化退，提示测者需控制初期投入成本。",反馈项目启动成功，进展平稳。?(六爻实战卦100例2),Feedback: The project was launched successfully and progressed smoothly. ?(Example 2 of 100 Six Yao Practical Battle Hexagrams),"A prosperous financial line turns into auspiciousness, indicating that the conditions for project start-up are good.
The world is quiet and receding, reminding testers that they need to control initial investment costs.",45,33,geng
147,是否能顺利完成公司内部的资源整合？,0,Can the company's internal resource integration be successfully completed?,癸巳年甲午月丁酉日,"
兄弟爻旺动，显示内部沟通与协调需加强。
世爻静而得日扶，提示整合进程需逐步推进。",反馈整合顺利完成，提升了整体效率。?(六爻名家卦例大收集47),"Feedback integration was successfully completed, improving overall efficiency. ?(A large collection of six-line hexagrams from famous masters, 47)","The brotherhood is flourishing, indicating that internal communication and coordination need to be strengthened.
The world is quiet but Japan is getting support, suggesting that the integration process needs to be advanced step by step.",25,18,ding
148,是否能顺利获取重要市场数据？,0,Can you successfully obtain important market data?,乙未年丙午月庚辰日,"
官鬼爻旺动，显示市场数据的获取渠道畅通。
世爻旺相，提示测者需与合作方保持良好关系。",反馈数据及时到位，为后续决策提供了依据。?(六爻实战卦100例2),"Feedback data is received in a timely manner, providing a basis for subsequent decision-making. ?(Example 2 of 100 Six Yao Practical Battle Hexagrams)","Officials and ghosts are busy, indicating that the channels for obtaining market data are smooth.
The prosperity of the world indicates that the tester needs to maintain a good relationship with his collaborators.",40,50,geng
150,是否能顺利解决员工离职问题？,0,Can the problem of employee resignation be successfully solved?,甲申年癸未月庚辰日,"
兄弟爻旺动，显示离职问题需通过内部协调解决。
世爻静而化吉，提示测者需做好情绪安抚和后续交接工作。",反馈离职问题得到妥善解决，团队稳定性恢复。?(六爻实战卦100例2),Feedback indicates that the resignation issue has been properly resolved and team stability has been restored. ?(Example 2 of 100 Six Yao Practical Battle Hexagrams),"The brothers are moving vigorously, indicating that the resignation issue needs to be resolved through internal coordination.
The world is quiet and auspicious, suggesting that the tester needs to do a good job in emotional comfort and follow-up handover work.",13,20,geng
151,是否适合近期扩大线上业务？,0,Is it suitable to expand online business in the near future?,癸巳年甲午月丁酉日,"
财爻旺动，显示线上业务具备较高发展潜力。
世爻静而化退，提示需优化线上资源配置。",反馈业务扩展成功，流量和转化率均显著提高。?(六爻实战卦100例2),Feedback indicates that the business has been successfully expanded and traffic and conversion rates have increased significantly. ?(Example 2 of 100 Six Yao Practical Battle Hexagrams),"The wealth is booming, indicating that online business has high development potential.
The world is quiet and receding, suggesting the need to optimize online resource allocation.",42,45,ding
152,是否能及时完成紧急订单？,0,Can urgent orders be completed in time?,乙未年丙午月庚辰日,"
财爻旺动化吉，显示订单可如期交付。
世爻静，提示测者需协调好供应链与生产流程。",反馈订单提前完成，客户满意度较高。?(六爻名家卦例大收集47),"Feedback is that orders are completed ahead of schedule and customer satisfaction is high. ?(A large collection of six-line hexagrams from famous masters, 47)","A prosperous financial line turns into good luck, indicating that the order can be delivered as scheduled.
Shi Yaojing reminds testers to coordinate the supply chain and production process.",25,31,geng
153,是否能顺利推进海外合作项目？,0,Can overseas cooperation projects be smoothly promoted?,甲午年乙未月庚寅日,"
财爻旺动，显示合作项目的资源条件具备。
世爻旺相，提示测者需重点关注跨文化沟通的细节。",反馈合作按计划推进，获得良好国际评价。?(六爻实战卦100例2),Feedback Cooperation progressed as planned and received good international evaluation. ?(Example 2 of 100 Six Yao Practical Battle Hexagrams),"The money line is prosperous, indicating that the resource conditions for the cooperation project are available.
The prosperous appearance of Shi Yao reminds test takers to focus on the details of cross-cultural communication.",40,22,geng
154,是否适合近期启动家庭装修计划？,0,Is it suitable to start a home renovation plan in the near future?,癸未年甲午月丁酉日,"
父母爻旺动，显示装修条件成熟。
世爻静而化退，提示需控制预算，确保装修质量。",反馈装修按时完成，家庭整体满意度高。?(六爻名家卦例大收集47),"Feedback: The renovation was completed on time and the overall family satisfaction was high. ?(A large collection of six-line hexagrams from famous masters, 47)","The parents' lines are vigorous and active, indicating that the conditions for decoration are mature.
The world fades away quietly, suggesting the need to control the budget and ensure the quality of decoration.",45,33,ding
155,是否能及时解决库存积压问题？,0,Can the inventory backlog problem be solved in time?,癸巳年乙未月庚辰日,"
财爻旺动化进，显示库存问题可以通过调整销售策略解决。
世爻旺相，提示测者需寻找渠道创新突破口。",反馈库存逐步清理，销售额明显提升。?(六爻实战卦100例2),Feedback showed that inventory was gradually cleared and sales increased significantly. ?(Example 2 of 100 Six Yao Practical Battle Hexagrams),"The financial situation is booming, indicating that inventory problems can be solved by adjusting sales strategies.
The prosperity of the world prompts testers to find breakthroughs in channel innovation.",14,9,geng
156,是否能如期完成团队内部培训计划？,0,Can the team's internal training plan be completed as scheduled?,甲午年乙未月庚辰日,"
父母爻旺动，显示培训资源充足。
世爻静而得日扶，提示测者需加强时间管理。",反馈培训计划完成，团队技能显著提高。?(六爻实战卦100例2),Feedback training program completed and team skills improved significantly. ?(Example 2 of 100 Six Yao Practical Battle Hexagrams),"Parents are active, which shows that training resources are sufficient.
The world is quiet and the day is supported, suggesting that the tester needs to strengthen time management.",31,50,geng
157,是否能成功调整产品定价策略？,0,Can you successfully adjust your product pricing strategy?,丙辰年壬午月庚寅日,"
财爻旺动化吉，显示定价策略的调整具备市场需求。
世爻化退，提示测者需综合考虑竞争对手和客户反馈。",反馈调整后市场反应积极，销量有所提升。?(六爻名家卦例大收集47),"After the feedback adjustment, the market responded positively and sales increased. ?(A large collection of six-line hexagrams from famous masters, 47)","The prosperity of wealth turns into good fortune, indicating that there is market demand for adjustments to pricing strategies.
Shi Yao is retreating, prompting testers to comprehensively consider competitor and customer feedback.",22,18,geng
158,是否适合近期购买设备？,0,Is it suitable to purchase equipment in the near future?,癸未年甲午月乙亥日,"
父母爻旺动，显示设备性能优越，购买条件良好。
世爻静而化吉，提示测者需对供应商进行充分评估。",反馈设备购买顺利，使用效果良好。?(六爻实战卦100例2),Feedback: The purchase of the equipment went smoothly and the results are good. ?(Example 2 of 100 Six Yao Practical Battle Hexagrams),"The parents are very active, indicating that the device has excellent performance and the purchase conditions are good.
The world is quiet and auspicious, prompting the tester to fully evaluate the supplier.",45,25,yi
159,是否能顺利与竞争对手达成合作？,0,Can you successfully cooperate with competitors?,甲申年乙未月庚辰日,"
财爻旺动，显示合作对双方有利。
世爻静而化进，提示测者需展现诚意，加强信任建立。",反馈合作成功达成，双方关系融洽。?(六爻名家卦例大收集47),"Feedback The cooperation was successfully achieved and the relationship between the two parties was harmonious. ?(A large collection of six-line hexagrams from famous masters, 47)","The money line is prosperous, indicating that cooperation is beneficial to both parties.
The world is quiet and evolving, reminding testers to show sincerity and strengthen trust building.",13,19,geng
160,是否能顺利完成年度战略规划？,0,Can the annual strategic plan be successfully completed?,癸巳年乙未月庚辰日,"
父母爻旺动，显示规划资源准备充分。
世爻旺相，提示测者需注重规划实施的落地细节。",反馈战略规划顺利通过，公司目标明确。?(六爻实战卦100例2),Feedback: The strategic plan was successfully passed and the company's goals are clear. ?(Example 2 of 100 Six Yao Practical Battle Hexagrams),"Parents are active, indicating that planning resources are fully prepared.
The prosperity of the world reminds testers to pay attention to the implementation details of planning and implementation.",40,50,geng
161,是否能成功拓展新业务渠道？,0,Can you successfully expand new business channels?,癸未年甲午月丁卯日,"
财爻旺动，显示新渠道拓展机会较大。
世爻旺相，提示测者需注重市场调研及长期规划。",反馈新业务渠道开拓成功，客户群显著增长。?(六爻名家卦例大收集47),"Feedback is that new business channels have been successfully developed and the customer base has grown significantly. ?(A large collection of six-line hexagrams from famous masters, 47)","The wealth is booming, indicating greater opportunities for new channel expansion.
The prosperity of the world reminds testers to pay attention to market research and long-term planning.",42,30,ding
163,是否能成功签署跨国合作协议？,0,Can a cross-border cooperation agreement be successfully signed?,癸巳年甲午月乙亥日,"
财爻旺动化吉，显示合作协议条件成熟。
世爻旺相，提示测者需关注文化差异及法律问题。",反馈协议顺利签署，为公司开辟新市场。?(六爻实战卦100例2),"The feedback agreement was successfully signed, opening up new markets for the company. ?(Example 2 of 100 Six Yao Practical Battle Hexagrams)","A prosperous financial line turns into auspiciousness, indicating that the conditions for a cooperation agreement are mature.
The prosperous phase of the world reminds testers to pay attention to cultural differences and legal issues.",14,33,yi
164,是否能及时解决家庭财务压力？,0,Can family financial pressure be resolved in a timely manner?,乙未年丙午月庚辰日,"
财爻旺动，显示收入提升或债务减少的可能性较大。
世爻静而化进，提示测者需严格控制支出。",反馈家庭财务逐步改善，负担显著减轻。?(六爻实战卦100例2),Feedback is that family finances have gradually improved and the burden has been significantly reduced. ?(Example 2 of 100 Six Yao Practical Battle Hexagrams),"The money line is prosperous, indicating that there is a greater possibility of income increase or debt reduction.
The world is quiet and evolving, suggesting that testers need to strictly control their expenditures.",25,45,geng
165,是否能顺利开展新产品试销？,0,Can the trial sales of new products be successfully carried out?,甲午年癸未月庚寅日,"
财爻旺动，显示试销市场反馈积极。
世爻化退，提示测者需关注产品定价及用户需求。",反馈试销成功，市场接受度高，订单增加。?(六爻名家卦例大收集47),"Feedback is that the trial marketing was successful, market acceptance was high, and orders increased. ?(A large collection of six-line hexagrams from famous masters, 47)","The financial line is booming, indicating positive feedback from the test market.
The world has faded away, reminding testers to pay attention to product pricing and user needs.",42,19,geng
